{
  "protocol_version": "1.1",
  "worker_epoch": "11111111-1111-4111-8111-111111111111",
  "sequence": 1,
  "kind": "Dispatch",
  "operation_id": "11111111-1111-4111-8111-111111111111",
  "fence": 1,
  "body": {
    "request": {
      "artifact_id": "artifact-11111111111111111111111111111111",
      "sha256": "aaaaaaaaaaaaaaaaaaaaaaaaaaaaaaaaaaaaaaaaaaaaaaaaaaaaaaaaaaaaaaaa"
    },
    "attempt": 1,
    "input_hash": "aaaaaaaaaaaaaaaaaaaaaaaaaaaaaaaaaaaaaaaaaaaaaaaaaaaaaaaaaaaaaaaa",
    "plan_hash": null
  }
}
