{
  "protocol_version": "1.1",
  "worker_epoch": "11111111-1111-4111-8111-111111111111",
  "sequence": 1,
  "kind": "Hello",
  "operation_id": null,
  "fence": 0,
  "body": {
    "pid": 123,
    "start_ticks": 638000000000000000,
    "nonce": "11111111-1111-4111-8111-111111111111",
    "worker_id": "tia-bridge.v19.read-only",
    "build": "1.0"
  }
}
