{
  "protocol_version": "1.1",
  "worker_epoch": "11111111-1111-4111-8111-111111111111",
  "sequence": 1,
  "kind": "Receipt",
  "operation_id": "11111111-1111-4111-8111-111111111111",
  "fence": 1,
  "body": {
    "attempt": 1,
    "input_hash": "aaaaaaaaaaaaaaaaaaaaaaaaaaaaaaaaaaaaaaaaaaaaaaaaaaaaaaaaaaaaaaaa",
    "plan_hash": null,
    "receipt": {
      "disposition": "Rejected",
      "report": null,
      "error_code": "WORKER_UNAVAILABLE",
      "effect_count": 0,
      "quiescent": true
    }
  }
}
